,Datetime,Media,Title,Desc,Link
422,2021-09-30 7:50 AM,Biotech,Sunovion pens $890M Otsuka neuropsychiatric drug pact,"Sunovion, owned by Japan’s Sumitomo Dainippon Pharma, has signed a near $1 billion upfront/biobucks mix deal with fellow Japanese native Otsuka.","<a href=https://www.fiercebiotech.com/biotech/sunovion-pens-890m-otsuka-pact-for-a-clutch-neuropsychiatric-drugs target=""_blank""><div>Link</div></a>"
423,2021-09-30 7:49 PM,MedCity,Feds provide payment resolution process in new surprise billing rule,"Per the new interim final rule, parties that cannot agree on out-of-network payment rates must enter into a 30-day open negotiation period. If that fails, an independent entity will be engaged to make the final decision. ","<a href=https://medcitynews.com/2021/09/feds-provide-payment-resolution-process-in-new-surprise-billing-rule/ target=""_blank""><div>Link</div></a>"
424,2021-09-30 5:57 PM,MedCity,Merck to buy Acceleron for $11.5B; cardio drug could cushion fall from Keytruda cliff,"Merck is looking for products that diversify its portfolio beyond reliance on cancer drug Keytruda, and it sees a potential blockbuster cardiovascular drug from Acceleron Pharma as fitting the bill. The pharma giant is paying $11.5 billion to acquire the biotech, and executives say they’re still on the hunt for more deals.","<a href=https://medcitynews.com/2021/09/merck-to-buy-acceleron-for-11-5b-cardio-drug-could-cushion-fall-from-keytruda-cliff/ target=""_blank""><div>Link</div></a>"
425,2021-09-30 5:20 PM,MedCity,MedCity Spotlight Video: Fredrikson & Byron attorneys discuss Covid-19’s impact on deal-making and value-based care,"In a Spotlight Video interview, Fredrikson & Byron Shareholders and Co-chairs of the firm’s life sciences group, Jeff Steinle and Ryan Johnson, talked about the deal-making environment in healthcare and how the Covid-19 pandemic has impacted it. ","<a href=https://medcitynews.com/2021/09/medcity-spotlight-video-fredrikson-byron-attorneys-discuss-covid-19s-impact-on-deal-making-and-value-based-care/ target=""_blank""><div>Link</div></a>"
426,2021-09-30 5:15 PM,MedCity,Google’s DeepMind faces suit over access to NHS patient records,"London-based firm Mishcon de Reya said it filed a claim in the U.K.’s High Court, alleging that Google’s access of 1.6 million people’s medical records broke privacy rules. NHS’ Royal Free London had struck an agreement with DeepMind in 2015 to build a system for alerting clinicians. ","<a href=https://medcitynews.com/2021/09/googles-deepmind-faces-suit-over-access-to-nhs-patient-records/ target=""_blank""><div>Link</div></a>"
427,2021-09-30 5:00 AM,MedCity,Former Shire asset becomes Mirum’s first FDA-approved rare disease drug,"Mirum Pharmaceuticals drug Livmarli is now approved to treat pruritus caused by Alagille syndrome, a rare liver disease that can worsen to the point of requiring a transplant. Mirum licensed the drug from Shire in 2018.","<a href=https://medcitynews.com/2021/09/former-shire-asset-becomes-mirums-first-fda-approved-rare-disease-drug/ target=""_blank""><div>Link</div></a>"
428,2021-09-30 3:35 PM,Biotech,Blood storage tech developer Hemanext adds $15M to VC stores,"Hemanext is hoping to give standard blood storage practices a transfusion of their own—but of innovation, rather than blood cells.","<a href=https://www.fiercebiotech.com/medtech/blood-storage-tech-developer-hemanext-adds-15m-to-vc-stores-as-it-preps-for-fda-submission target=""_blank""><div>Link</div></a>"
429,2021-09-30 3:30 PM,Biotech,Ventyx files for $100M IPO to fund 6 or more trials by 2023,Ventyx Biosciences is headed from California to Wall Street with plans for a customary $100 million IPO.,"<a href=https://www.fiercebiotech.com/biotech/at-least-six-trials-planned-before-2023-ventyx-biosciences-lines-up-for-100m-ipo target=""_blank""><div>Link</div></a>"
430,2021-09-30 2:32 PM,MedCity,"With 5 patents under its belt, RCM tech company Ensemble Health Partners files for IPO","The company, which provides revenue cycle management solutions for providers, is filing for the IPO less than two years after Bon Secours Mercy Health sold its majority stake in Ensemble to private equity firm Golden Gate Capital. Per the filing, the company aims to raise $100 million, but that is likely a placeholder figure. ","<a href=https://medcitynews.com/2021/09/with-5-patents-under-its-belt-rcm-tech-company-ensemble-health-partners-files-for-ipo/ target=""_blank""><div>Link</div></a>"
431,2021-09-30 2:00 PM,MedCity,Building pharma resilience by establishing a culture of quality,"The dirty secret that many life sciences and medical device companies don’t want people to know is that, to date, quality management has primarily been paper-based AND an afterthought in comparison to key strategic initiatives such as product development.","<a href=https://medcitynews.com/2021/09/building-pharma-resilience-by-establishing-a-culture-of-quality/ target=""_blank""><div>Link</div></a>"
432,2021-09-30 12:51 PM,Biotech,Laurent's COVID oral therapy fails in hospitalized patient trial,Laurent Pharmaceuticals' COVID-19 oral therapy did not meet its goal of improving the proportion of patients alive and free of respiratory failure.,"<a href=https://www.fiercebiotech.com/biotech/laurent-s-covid-19-pill-fails-phase-2-but-data-helps-narrow-down-patients-who-may-benefit target=""_blank""><div>Link</div></a>"
433,2021-09-30 12:12 PM,Biotech,AR software maker Activ Surgical augments VC funding with $45M,"The series B came courtesy of a baker’s dozen of new and existing investors, led by Cota Capital.","<a href=https://www.fiercebiotech.com/medtech/activ-surgical-augments-vc-funding-45m-for-ar-based-software target=""_blank""><div>Link</div></a>"
434,2021-09-30 11:44 AM,Biotech,Artificial heart maker SynCardia beamed up by Picard Medical,"The company takes its inspiration from the eponymous captain of the starship Enterprise, who is known to carry an artificial heart of his own.","<a href=https://www.fiercebiotech.com/medtech/total-artificial-heart-maker-syncardia-beamed-up-by-newcomer-picard-medical target=""_blank""><div>Link</div></a>"
435,2021-09-30 11:07 AM,Biotech,"Merck KGaA, GSK cut ties on $4.2B bintrafusp alfa deal",Merck KGaA and GSK are ending a partnership for the cancer drug bintrafusp alfa which could have netted billions for the German pharma if successful.,"<a href=https://www.fiercebiotech.com/biotech/merck-kgaa-gsk-cut-ties-bintrafusp-alfa-deal-had-4-2b-biobucks-line target=""_blank""><div>Link</div></a>"
436,2021-09-30 11:00 AM,Biotech,Bausch-Novaliq's eye drop beats placebo again in phase 3 trial,Patients with dry eye disease taking Bausch + Lomb's eye drop reported an improvement in the severity of eye dryness during a phase 3 clinical trial.,"<a href=https://www.fiercebiotech.com/biotech/bausch-novaliq-s-eye-drop-beats-placebo-2nd-phase-3-trial-dry-eye-disease-filing-2022 target=""_blank""><div>Link</div></a>"
437,2021-09-30 10:54 AM,Biotech,"AstraZeneca, others support newly private Cellular with $120M",Cellular Biomedicine Group is hitting the ground running as a newly private company with $120 million from AstraZeneca and others.,"<a href=https://www.fiercebiotech.com/biotech/now-private-cellular-biomedicine-snags-120m-from-astrazeneca-others-for-oncology target=""_blank""><div>Link</div></a>"
438,2021-09-30 10:13 AM,Biotech,Novartis claims win with BTK inhibitor where others have failed,"After a string of Big Pharmas reported failures for their BTK inhibitors in autoimmune disorders, Novartis finally appears to have a winner.","<a href=https://www.fiercebiotech.com/biotech/novartis-btk-inhibitor-successful-phase-2b-clinical-trial-remibrutinib target=""_blank""><div>Link</div></a>"
439,2021-09-29 9:55 AM,Biotech,"FDA clears wireless, blood pressure-monitoring finger sensor","Attached around the patient’s finger, the VitalStream device aims to catch the changes in blood pressure that may occur during surgery.","<a href=https://www.fiercebiotech.com/medtech/fda-clears-wireless-blood-pressure-monitoring-finger-sensor-from-caretaker-medical target=""_blank""><div>Link</div></a>"
440,2021-09-29 9:00 AM,Biotech,What's next for the NIH's RADx program for COVID tests?,"Bruce Tromberg, director of the NIH’s National Institute of Biomedical Imaging and Bioengineering, outlined what’s next for RADx.","<a href=https://www.fiercebiotech.com/medtech/what-s-next-for-radx-nih-drafts-a-to-do-list-for-its-1-5b-diagnostics-competition-through target=""_blank""><div>Link</div></a>"
441,2021-09-29 9:00 AM,MedCity,Medtech is well-positioned for investment and growth following surge in biopharma,"The success of biopharma and medtech are not mutually exclusive. In some ways, medtech is actually drafting off of the recent surge in interest and investment in biopharma.","<a href=https://medcitynews.com/2021/09/medtech-is-well-positioned-for-investment-and-growth-following-surge-in-biopharma/ target=""_blank""><div>Link</div></a>"
442,2021-09-29 9:00 AM,Biotech,Editas claims proof of concept in vision loss gene-editing,Editas has confirmed safety—and its concept—in a small group of patients who have received the gene-editing therapy EDIT-101.,"<a href=https://www.fiercebiotech.com/biotech/editas-presents-gene-editing-first-human-results-for-edit-101-lca10 target=""_blank""><div>Link</div></a>"
443,2021-09-29 8:35 AM,Biotech,Amicus spins off gene therapy unit in $600M SPAC deal,"Amicus has endured a tough few years of pipeline flops and a roller coaster stock ride, but now it’s riding the SPAC wave.","<a href=https://www.fiercebiotech.com/biotech/amicus-spins-off-gene-therapy-unit-600m-spac-deal-as-ceo-moves-over-to-caritas-therapeutics target=""_blank""><div>Link</div></a>"
444,2021-09-29 8:20 AM,Biotech,I-Mab hits the deal table with biopharma majors: report,I-Mab is reportedly conducting a strategic review that could lead to cooperation on clinical development in China or the sale of an equity stake.,"<a href=https://www.fiercebiotech.com/biotech/i-mab-hits-deal-table-biopharma-majors-to-talk-partnerships-and-investments-report target=""_blank""><div>Link</div></a>"
445,2021-09-29 8:00 AM,Biotech,Leo Pharma inks digital clinical trials partnership with Veeva,The COVID-19 pandemic accelerated LEO Pharma's clinical trial transformation and it's doubling down in a digital trial partnership with Veeva Systems.,"<a href=https://www.fiercebiotech.com/cro/leo-pharma-inks-partnerships-veeva-systems-industry-movement-toward-digital-trials target=""_blank""><div>Link</div></a>"
446,2021-09-29 7:15 AM,Biotech,AstraZeneca bags late-phase hematology prospect in $150M buyout,"AstraZeneca is continuing to build out its rare disease pipeline, pulling the trigger on an option to buy Caelum it picked up in its Alexion deal.","<a href=https://www.fiercebiotech.com/biotech/astrazeneca-moves-deeper-into-rare-diseases-spending-150m-late-phase-hematology-prospect target=""_blank""><div>Link</div></a>"
447,2021-09-29 7:00 AM,Biotech,Sanofi-backed Expansion nabs $80M for RNA neurodegenerative work,"Expansion Therapeutics wants to go up against Dyne, Locanabio in myotonic dystrophy. The Sanofi, Novartis-backed biotech now has $80M for the rivalry.","<a href=https://www.fiercebiotech.com/biotech/novartis-sanofi-backed-expansion-snags-80m-for-neurodegenerative-assets-to-rival-dyne target=""_blank""><div>Link</div></a>"
448,2021-09-29 3:00 AM,Biotech,In vivo gene editing grabs the spotlight after Intellia triumph,"Several companies are advancing in vivo gene editing to treat a range of diseases, but they're doing so amid safety concerns surrounding gene therapy.","<a href=https://www.fiercebiotech.com/research/vivo-gene-editing-grabs-spotlight-after-intellia-triumph-but-challenges-loom target=""_blank""><div>Link</div></a>"
449,2021-09-29 2:00 PM,Biotech,Exploiting a protective gene mutation to fend off Alzheimer's,"A mutation in the APOE3 gene increases the formation of fatty molecules that may shield against Alzheimer's, a Mayo Clinic team reported.","<a href=https://www.fiercebiotech.com/research/how-a-genetic-factor-might-protect-brain-from-alzheimer-s-disease target=""_blank""><div>Link</div></a>"
450,2021-09-29 12:23 PM,Biotech,Biotech incubator Sporos' new CEO arrives from Ovid,"Amit Rakhit has jumped from Ovid Therapeutics to be CEO of Sporos Bioventures, a Houston incubator with four biotechs under its wings.","<a href=https://www.fiercebiotech.com/biotech/ovid-cmo-amit-rakhit-heads-to-houston-biotech-incubator-sporos-as-ceo target=""_blank""><div>Link</div></a>"
451,2021-09-29 11:56 AM,Biotech,FDA takes note of stroke-preventing heart implant risk in women,"The agency alerted providers about findings published in JAMA Cardiology, which tracked procedures with Boston Scientific’s Watchman device.","<a href=https://www.fiercebiotech.com/medtech/study-finds-stroke-preventing-heart-implant-more-risky-for-women-as-fda-takes-notice target=""_blank""><div>Link</div></a>"
452,2021-09-29 11:38 AM,Biotech,FDA approves TransMedics’ donor liver preservation system,"Weeks after receiving an FDA nod for its heart-preserving cart, TransMedics' “miniature ICU” for extending donor liver function won a nod of its own.","<a href=https://www.fiercebiotech.com/medtech/transmedics-locks-2nd-fda-approval-a-month-nod-for-donor-liver-preservation-system target=""_blank""><div>Link</div></a>"
453,2021-09-29 10:35 AM,Biotech,"Bayer, Huma begin building AI to classify lung cancer types",The latest of Bayer and Huma's joint projects has the duo building an AI-powered tool that will analyze CT scans to improve lung cancer diagnoses.,"<a href=https://www.fiercebiotech.com/medtech/bayer-strengthens-ties-huma-collaborating-ai-to-classify-lung-cancer-types target=""_blank""><div>Link</div></a>"
454,2021-09-29 10:05 AM,Biotech,"FDA said no in July, so Iterum will test UTI antibiotic again",Iterum Therapeutics will give its uncomplicated UTI antibiotic a second shot at FDA approval by conducting another phase 3 trial.,"<a href=https://www.fiercebiotech.com/biotech/iterum-will-give-uti-antibiotic-another-go-new-trial-after-meeting-fda target=""_blank""><div>Link</div></a>"
455,2021-09-28 9:10 AM,Biotech,Shionogi licenses out 3rd-gen HIV asset to ViiV,Japanese pharma Shionogi has penned a new licensing deal for a long-acting HIV asset from ViiV.,"<a href=https://www.fiercebiotech.com/biotech/shionogi-licences-third-gen-hiv-asset-ultra-long-dosing-prospect-from-its-partly-owned target=""_blank""><div>Link</div></a>"
456,2021-09-28 8:00 AM,Biotech,"Eisai, Biogen start rolling submission for Alzheimer's drug","Having reset the bar to U.S. market access with Aduhelm, the partners have begun a rolling submission for another anti-amyloid beta antibody.","<a href=https://www.fiercebiotech.com/biotech/here-we-go-again-eisai-starts-rolling-fda-approval-submission-for-biogen-partnered target=""_blank""><div>Link</div></a>"
457,2021-09-28 7:52 PM,MedCity,FDA to review data on stroke-prevention implants after study finds more adverse events in women,"A study published in August found that women experienced more adverse events from Boston Scientific’s Watchman implant than men. The FDA said it plans to take a closer look at data for these stroke-prevention implants, but still says the benefits outweigh the risks. ","<a href=https://medcitynews.com/2021/09/fda-to-review-data-on-stroke-prevention-implants-after-study-finds-more-adverse-events-in-women/ target=""_blank""><div>Link</div></a>"
458,2021-09-28 7:45 AM,Biotech,Sanofi dumps mRNA COVID-19 vaccine after seeing early data,Sanofi is dumping the mRNA COVID-19 vaccine prospect after seeing interim phase 1/2 data and accelerating its switch to modified mRNA. ,"<a href=https://www.fiercebiotech.com/biotech/after-3-2b-deal-sanofi-pivots-mrna-dumping-covid-19-vaccine-and-accelerating-switch-to target=""_blank""><div>Link</div></a>"
459,2021-09-28 7:30 AM,Biotech,Valneva sees Lyme disease vaccine drop-off in phase 2,Valneva and partner Pfizer say their experimental Lyme disease vaccine has seen a drop-off in protection after 18 months and will need a booster.,"<a href=https://www.fiercebiotech.com/biotech/valneva-hit-by-covid-contract-chaos-sees-lyme-disease-vaccine-drop-off-phase-2-but-boosters target=""_blank""><div>Link</div></a>"
460,2021-09-28 6:37 PM,MedCity,"Provider groups back Hackensack Meridian Health, Englewood Health’s appeal against merger delay",The American Hospital Association and Association of American Medical Colleges have filed an amicus brief in support of the New Jersey health systems that are appealing a court decision to delay their merger following a legal challenge from the FTC. ,"<a href=https://medcitynews.com/2021/09/provider-groups-back-hackensack-meridian-health-englewood-healths-appeal-against-merger-delay/ target=""_blank""><div>Link</div></a>"
461,2021-09-28 6:30 AM,Biotech,Anji Pharma snags $70M for phase 3 diabetes and mid-stage asset,"Anji Pharma picks up $70 million for phase 3 diabetes treatment, mid-stage constipation drug and preclinical oncology asset from the Broad Institute.","<a href=https://www.fiercebiotech.com/biotech/anji-pharma-secures-70m-series-b-for-phase-3-diabetes-asset-mid-stage-constipation target=""_blank""><div>Link</div></a>"
462,2021-09-28 6:05 AM,Biotech,Roche's Genentech to use Lifelink Systems' chatbot for patients,Patients looking for info about Genentech's clinical trials and drugs have a new tool at their fingertips: a digital chatbot from Lifelink Systems.,"<a href=https://www.fiercebiotech.com/cro/roche-s-genentech-will-communicate-patients-trial-participants-using-lifelink-system-s-chatbot target=""_blank""><div>Link</div></a>"
463,2021-09-28 5:06 PM,MedCity,"Anji Pharma adds $70M for clinical trials, expansion of ‘hub and spoke’ biz model","Cross-border biotech Anji Pharma closed $70 million in Series B funding to advance a drug pipeline that includes metabolic and cancer drugs. The biotech’s business model of finding promising drugs and forming subsidiaries to develop them is similar to approaches taken by Roivant Sciences and BridgeBio Pharma, among others.","<a href=https://medcitynews.com/2021/09/anji-pharma-adds-70m-for-clinical-trials-expansion-of-hub-and-spoke-biz-model/ target=""_blank""><div>Link</div></a>"
464,2021-09-28 4:39 PM,MedCity,Apply now to the INVEST Pop Health Pitch Perfect startup contest,"If you’re a startup focused on population health, addressing social determinants of health, or helping people manage chronic diseases, you should apply by October 22.","<a href=https://medcitynews.com/2021/09/apply-now-to-the-invest-pop-health-pitch-perfect-startup-contest/ target=""_blank""><div>Link</div></a>"
465,2021-09-28 3:51 PM,MedCity,Epic deploys Covid-19 vaccine credentialing feature,"Epic’s Covid-19 vaccine credential, which shows up as a QR code within the MyChart patient portal, can be used to verify a person’s immunization status. About 25 million people currently have access to the vaccine credential, and Epic plans to expand it to 100 million by 2022. ","<a href=https://medcitynews.com/2021/09/epic-deploys-covid-19-vaccine-credential-feature/ target=""_blank""><div>Link</div></a>"
466,2021-09-28 3:10 PM,Biotech,Medtronic's newly acquired radial artery catheters go global,"Barely a year after the Rist radial access catheter technology made its operating room debut in Chicago, Medtronic is bringing the devices overseas.","<a href=https://www.fiercebiotech.com/medtech/medtronic-s-newly-acquired-radial-artery-catheters-go-global-european-approval target=""_blank""><div>Link</div></a>"
467,2021-09-28 3:00 PM,Biotech,Eli Lilly taps Reify's Care Access to diversify oncology trials,"They partnered on testing the COVID-19 antibody bamlanivimab. Now, Eli Lilly and Care Access are working to diversify a phase 3 breast cancer trial.","<a href=https://www.fiercebiotech.com/cro/eli-lilly-taps-reify-health-s-care-access-to-diversify-oncology-clinical-trials target=""_blank""><div>Link</div></a>"
468,2021-09-28 2:36 PM,MedCity,CVS sues pharmacy benefit startup Capital Rx over ‘unenforceable’ non-compete clause,"After Capital Rx’s former medical director of pharmacy services got a job offer at CVS, the PBM startup claimed he couldn’t work there because of a noncompete agreement. CVS recently sued the company, saying its non-compete clause was unenforceable.","<a href=https://medcitynews.com/2021/09/cvs-sues-pharmacy-benefit-startup-capital-rx-over-unenforceable-non-compete-clause/ target=""_blank""><div>Link</div></a>"
469,2021-09-28 2:00 PM,MedCity,We can prevent the next pandemic with data,"To be effective at preventing the next pandemic, everyone will have to play their part, from global agencies and governments right down to individuals. At all levels, digital and data must drive our planning and preparation.","<a href=https://medcitynews.com/2021/09/we-can-prevent-the-next-pandemic-with-data/ target=""_blank""><div>Link</div></a>"
470,2021-09-28 2:00 AM,Biotech,"Union, Innovent ink $247M biobucks deal for psoriasis therapy","Innovent Biologics to dish out up to $267 million for rights to Union's atopic dermatitis and psoriasis drug hopeful, acquired from Leo Pharma.","<a href=https://www.fiercebiotech.com/biotech/innovent-to-pay-union-up-to-267m-for-china-rights-to-mid-stage-psoriasis-eczema-asset target=""_blank""><div>Link</div></a>"
471,2021-09-28 1:55 PM,MedCity,"Another Eisai, Biogen Alzheimer’s drug is filed for speedy FDA review","Eisai is seeking accelerated FDA approval of lecanemab, an Alzheimer’s disease drug that is part of a research alliance with Biogen. The drug is following the same path blazed earlier this year with FDA approval of Biogen Alzheimer’s drug Aduhelm.","<a href=https://medcitynews.com/2021/09/another-eisai-biogen-alzheimers-drug-is-filed-for-speedy-fda-review/ target=""_blank""><div>Link</div></a>"
472,2021-09-28 1:09 PM,Biotech,Pfizer tightens DMD trial criteria over safety concerns,Pfizer is tightening up the criteria for a Duchenne muscular dystrophy gene therapy after three serious adverse events were seen in ongoing studies.,"<a href=https://www.fiercebiotech.com/biotech/pfizer-tightening-duchenne-muscular-dystrophy-phase-3-criteria-adverse-events target=""_blank""><div>Link</div></a>"
473,2021-09-28 1:04 PM,Biotech,FDA asks for study do-overs at 2 CROs due to data concerns,The FDA has asked biopharmas to repeat studies they had already conducted at two CROs in India.,"<a href=https://www.fiercebiotech.com/cro/fda-asks-pharmas-to-repeat-studies-done-at-two-indian-cros-due-to-data-integrity-issues-report target=""_blank""><div>Link</div></a>"
474,2021-09-28 11:55 AM,Biotech,MIT cell-engineering spinout nets $30M for production platform,"One of the tricks of getting cell therapies to work is getting the payload you want into the cell itself—be it RNA, DNA or CRISPR proteins.","<a href=https://www.fiercebiotech.com/medtech/mit-cell-engineering-spinout-nets-30m-for-mass-manufacturing-platform target=""_blank""><div>Link</div></a>"
475,2021-09-28 10:29 AM,Biotech,Vensana Capital ups medtech investments with $325M 2nd fund,Vensana Capital II will enable the VC firm to significantly scale up its investments in medtechs in both the development and commercial stage.,"<a href=https://www.fiercebiotech.com/medtech/vensana-capital-redoubles-medtech-investment-efforts-325m-second-fund target=""_blank""><div>Link</div></a>"
476,2021-09-28 10:05 AM,Biotech,Ziopharm's new CEO fires half of his workforce in first month,"Less than 30 days into his post as CEO, Kevin Boyle laid off more than 50% of his staff as the company looks to move into a phase 1/2 trial next year.","<a href=https://www.fiercebiotech.com/biotech/ziopharm-s-new-ceo-cuts-50-workforce-amid-trial-delays-for-t-cell-receptor-therapy target=""_blank""><div>Link</div></a>"
477,2021-09-27 9:20 AM,Biotech,Pfizer's oral COVID-19 antiviral gets rolling in phase 2/3 trial,Pfizer is kick-starting a phase 2/3 clinical trial for an oral therapeutic antiviral for adults who have been exposed to the coronavirus.,"<a href=https://www.fiercebiotech.com/biotech/pfizer-s-preventative-covid-19-oral-antiviral-gets-rolling-phase-2-3-trial target=""_blank""><div>Link</div></a>"
478,2021-09-27 8:00 AM,Biotech,Connecting Big Pharma's shelved drugs with new investors: report,"If a potentially promising treatment sits idle in a Big Pharma's stockroom, shouldn’t patients have access to it? A new report says yes.","<a href=https://www.fiercebiotech.com/biotech/milken-institute-report-big-pharma-donating-shelved-medicines-to-nonoprofits target=""_blank""><div>Link</div></a>"
479,2021-09-27 7:45 AM,MedCity,Who won the INVEST Digital Health Pitch Perfect contest?,"Judges proclaimed winners across three tracks of the digital health startup pitch contest including: Home health, chronic disease management and value-based care, and technology to support payer and provider efficiency. ","<a href=https://medcitynews.com/2021/09/who-won-the-invest-digital-health-pitch-perfect-contest/ target=""_blank""><div>Link</div></a>"
480,2021-09-27 7:40 AM,Biotech,Delix snags $70M series A for psychedelic analog trials in 2022,"Delix Therapeutics, a 2021 Fierce 15 winner, aims to test two psychedelic analogs in clinical trials next year with the help of $70 million series A.","<a href=https://www.fiercebiotech.com/biotech/delix-raises-70m-to-test-psychedelic-analogs-for-treating-brain-disorders-clinical-trials target=""_blank""><div>Link</div></a>"
