,Datetime,Media,Title,Desc,Link
242,2021-10-15 12:41 PM,MedCity,"Resilience turns to Harvard for biologics manufacturing tech, inks 5-year R&D pact",Biomanufacturing technologies company Resilience is partnering with Harvard in a deal that could see innovations from the university’s labs commercialized under new businesses. Resilience has committed $30 million in funding to support Harvard biomanufacturing research.,"<a href=https://medcitynews.com/2021/10/resilience-turns-to-harvard-for-biologics-manufacturing-tech-inks-5-year-rd-pact/ target=""_blank""><div>Link</div></a>"
243,2021-10-15 12:12 PM,Biotech,"Agenus cell therapy spinout MiNK inks $40M IPO for cancer, COVID",MiNK Therapeutics inked its spot on the Nasdaq with a $40 million initial public offering on Friday to take its lead candidate through phase 1 trials.,"<a href=https://www.fiercebiotech.com/biotech/agenus-cell-therapy-spin-off-mink-inks-mark-wall-street-low-end-40m-ipo-for-cancer-covid-19 target=""_blank""><div>Link</div></a>"
244,2021-10-15 11:23 AM,Biotech,NIH deals out $77M to develop 12 new rapid COVID tests,"The new RADx awardees span home and point-of-care diagnostics, with a focus on low-cost tests to spot multiple respiratory infections within an hour.","<a href=https://www.fiercebiotech.com/medtech/nih-deals-out-77-7m-to-develop-12-new-rapid-covid-diagnostics-from-bd-quidel-and-more target=""_blank""><div>Link</div></a>"
245,2021-10-15 11:19 AM,Biotech,Roche welcomes PathAI into its open digital pathology initiative,Roche has tapped PathAI for a collaboration that looks to merge AI programs with its digital pathology work.,"<a href=https://www.fiercebiotech.com/medtech/roche-pathai-digital-pathology-cancer-artificial-intelligence target=""_blank""><div>Link</div></a>"
246,2021-10-15 10:20 AM,Biotech,Greenwood takes the top job at Kojin Therapeutics,Kojin Therapeutics nabs Luba Greenwood to lead its startup and run an all-woman leadership team.,"<a href=https://www.fiercebiotech.com/biotech/luba-greenwood-takes-top-job-at-kojin-therapeutics-leading-all-woman-biotech-c-suite target=""_blank""><div>Link</div></a>"
247,2021-10-15 10:05 AM,Biotech,FDA recalls Abbott COVID tests at risk of false positives,Abbott identified an issue with the software used by lab equipment to process swab samples for testing with two of its Alinity m assays.,"<a href=https://www.fiercebiotech.com/medtech/fda-adds-class-i-recall-label-to-abbott-alinity-covid-tests-high-risk-false-positives target=""_blank""><div>Link</div></a>"
248,2021-10-14 9:25 AM,Biotech,"COVID testing, turnarounds still uneven this far into pandemic","Labs of all stripes are facing worker shortages just like restaurants, though many are no longer hamstrung by supply bottlenecks.","<a href=https://www.fiercebiotech.com/medtech/covid-testing-turnaround-times-are-still-uneven-far-into-pandemic target=""_blank""><div>Link</div></a>"
249,2021-10-14 9:05 AM,Biotech,Omega taps Stanford to find targets for genome-tuning tech,"Having pulled off a $126 million IPO, the epigenomic specialist has teamed up with Stanford University School of Medicine to find eye disease targets.","<a href=https://www.fiercebiotech.com/biotech/omega-eyeing-new-uses-for-genome-tuning-tech-taps-stanford-to-find-ocular-disease-targets target=""_blank""><div>Link</div></a>"
250,2021-10-14 8:15 AM,Biotech,OnKure sets Diamond in C-suite ahead of Pfizer drug combo trial,"OnKure has put another piece of its C-suite in place, hiring Jennifer Diamond as chief medical officer to support oncology clinical development.","<a href=https://www.fiercebiotech.com/biotech/onkure-sets-diamond-c-suite-ahead-pfizer-drug-combo-trial target=""_blank""><div>Link</div></a>"
251,2021-10-14 8:06 AM,MedCity,Atlas Venture-incubated Rectify lands $100M to transport drug hunt to new grounds,Rectify Pharmaceuticals is taking an approach to disease that led to a successful franchise of Vertex Pharmaceutical lung drugs and expanding it to more diseases in more organs in the body. The startup has launched with $100 million in financing.,"<a href=https://medcitynews.com/2021/10/atlas-venture-incubated-rectify-lands-100m-to-transport-drug-hunt-to-new-grounds/ target=""_blank""><div>Link</div></a>"
252,2021-10-14 8:00 AM,Biotech,"Digital trials peaked amid COVID, but benefits mixed bag: survey","Decentralized clinical trial uptake leaped nearly 60% during the pandemic, but less than 60% of clinical R&D leaders said patient retention improved.","<a href=https://www.fiercebiotech.com/cro/decentralized-clinical-trials-skyrocketed-during-pandemic-but-patient-experience-mixed-bag target=""_blank""><div>Link</div></a>"
253,2021-10-14 7:39 PM,MedCity,"Jefferson Health, CommonSpirit Health CEOs to retire","CommonSpirit Health CEO Lloyd Dean is retiring next summer, while Jefferson Health CEO Dr. Stephen Klasko will step down at the end of the year. The longtime leaders have led their respective systems through several highs and lows, including the turbulent first 18 months of the Covid-19 pandemic. ","<a href=https://medcitynews.com/2021/10/jefferson-health-commonspirit-health-ceos-to-retire/ target=""_blank""><div>Link</div></a>"
254,2021-10-14 7:31 PM,MedCity,Proscia touts study showing digital pathology software detected melanoma ,The startup shared results of a prospective study showing its deep learning software detected melanoma with 93% sensitivity and 91% specificity. ,"<a href=https://medcitynews.com/2021/10/proscia-touts-study-showing-digital-pathology-software-detected-melanoma/ target=""_blank""><div>Link</div></a>"
255,2021-10-14 7:30 AM,MedCity,CEO of b.well Connected Health talks about how a near-fatal medical error inspired the company’s launch,Kristen Valdes explained that the company provides a healthcare digital transformation platform for health systems and also offers services for self-insured employers.,"<a href=https://medcitynews.com/2021/10/ceo-of-b-well-connected-health-talks-about-how-a-near-fatal-medical-error-inspired-the-companys-launch/ target=""_blank""><div>Link</div></a>"
256,2021-10-14 7:10 AM,Biotech,Malek jumps ship to run Novartis' NIBR oncology unit,"The Novartis Institutes for BioMedical Research's oncology department has poached Genentech’s Shiva Malek, Ph.D., to help lead its cancer research.","<a href=https://www.fiercebiotech.com/biotech/after-15-years-helping-lead-early-cancer-research-at-genentech-shiva-malek-jumps-ship-to target=""_blank""><div>Link</div></a>"
257,2021-10-14 7:00 AM,Biotech,"Restore your ABCs: Rectify nabs $100M, Vertex founding scientist","Formed by Vertex founding scientist Jonathan Moore, Rectify gets $100 million series A to rectify ABC transporters for genetic diseases.","<a href=https://www.fiercebiotech.com/biotech/rectify-s-work-abcs-lands-100m-series-a-vertex-founding-scientist target=""_blank""><div>Link</div></a>"
258,2021-10-14 6:44 PM,MedCity,INVEST DH Pitch Perfect winner spotlight: EHR-integrated Navimize wants to cut down a key patient pain point,"The startup, which won a Pitch Perfect contest at MedCity INVEST Digital Health, offers a solution that integrates with EHRs to predict wait times in doctors’ offices and texts patients in real time to let them know what to expect. This virtual waiting room can help increase efficiency and improve patient experience. ","<a href=https://medcitynews.com/2021/10/invest-dh-pitch-perfect-winner-spotlight-ehr-integrated-navimize-wants-to-cut-down-on-a-key-patient-pain-point/ target=""_blank""><div>Link</div></a>"
259,2021-10-14 2:31 PM,Biotech,Seasoned executive team launches Tentarix with $50M,Industry vets from Eli Lilly and more are ready for the next venture: launching Tentarix Biotherapeutics with a $50 million series A fundraising.,"<a href=https://www.fiercebiotech.com/biotech/stacked-cohort-industry-vets-set-to-launch-biotech-tentarix-biotherapeutics-50m-series-a target=""_blank""><div>Link</div></a>"
260,2021-10-14 12:24 PM,Biotech,Cue Health reups NBA COVID testing contract,"For the third NBA season in a row, Cue Health is hoping to lead the league in assists as its go-to COVID-19 testing company.","<a href=https://www.fiercebiotech.com/medtech/cue-health-snags-rebound-re-upping-nba-covid-testing-contract-for-another-season target=""_blank""><div>Link</div></a>"
261,2021-10-14 11:27 AM,Biotech,Exscientia AI spots which therapies work in blood cancer study,"At its core, the method follows a basic idea: take a test to see if the drug will work before it’s given. But AI has scaled up clinicians' efforts.","<a href=https://www.fiercebiotech.com/medtech/exscientia-ai-artificial-intelligence-study-results-blood-cancer-hematology-oncology target=""_blank""><div>Link</div></a>"
262,2021-10-14 10:40 AM,Biotech,Laborie acquires Pelvalon and its fecal incontinence device,"For its fourth acquisition in as many years, Laborie Medical Technologies has opted to build out its gastroenterology offerings.","<a href=https://www.fiercebiotech.com/medtech/laborie-expands-gi-profile-acquisition-pelvalon-and-its-female-fecal-incontinence-device target=""_blank""><div>Link</div></a>"
263,2021-10-14 10:22 AM,Biotech,Protein that manipulates gene expression could steer RSV drugs,New findings shed light on how the NS1 protein lurks into the cell nucleus to undermine the body's ability to off the common virus RSV.,"<a href=https://www.fiercebiotech.com/research/protein-manipulates-gene-expression-inside-nucleus-could-steer-new-rsv-drugs-vaccines target=""_blank""><div>Link</div></a>"
264,2021-10-14 10:05 AM,Biotech,Sanofi tries to quiet naysayers with data on Principia MS drug,"Tolebrutinib reduced multiple sclerosis disease activity seen on MRI scans from the patients in the trial at the 48-week point, Sanofi reported.","<a href=https://www.fiercebiotech.com/biotech/sanofi-tolebrutinib-extension-data-analyst-reaction-multiple-sclerosis-candidate target=""_blank""><div>Link</div></a>"
265,2021-10-13 9:00 AM,MedCity,CMS delays enforcement of Payer-to-Payer data exchange,The current delay is specific to one part of the law that needed rework; it should not be seen as an indicator that interoperability will not happen.,"<a href=https://medcitynews.com/2021/10/cms-delays-enforcement-of-payer-to-payer-data-exchange/ target=""_blank""><div>Link</div></a>"
266,2021-10-13 8:40 AM,Biotech,"Aum bags $27M to hit cancer targets pursued by Bayer, Roche","Aum is moving on to oncology turf targeted by companies including Bayer and Roche, securing $27 million to advance inhibitors of MNK and TRK.","<a href=https://www.fiercebiotech.com/biotech/aum-bags-27m-to-hit-cancer-targets-pursued-by-bayer-roche target=""_blank""><div>Link</div></a>"
267,2021-10-13 8:00 AM,Biotech,Takeda inks another biobucks pact: $900M for Immusoft's B cells,"Takeda links arms with yet another regenerative medicine biotech, this time in an up to $900 million pact with Immusoft for cell therapies.","<a href=https://www.fiercebiotech.com/biotech/takeda-bets-up-to-900m-immusoft-s-cell-therapies-for-neurometabolic-disorders target=""_blank""><div>Link</div></a>"
268,2021-10-13 7:55 AM,Biotech,More diversity needed in breast cancer clinical trials: report,Breastcancer.org urges more diversity in breast cancer clinical trials after 4 treatments approved by the FDA in 2020 enrolled few patients of color.,"<a href=https://www.fiercebiotech.com/cro/barriers-exist-but-participation-urgent-breast-cancer-clinical-trials-report target=""_blank""><div>Link</div></a>"
269,2021-10-13 7:45 AM,Biotech,"UPDATE: CRISPR hails safety, efficacy of off-the-shelf CAR-Ts","The prospect triggered responses in 58% of patients without causing grade 3 or higher CRS, but six-month durability compared unfavorably to rivals.","<a href=https://www.fiercebiotech.com/biotech/crispr-hails-safety-efficacy-off-shelf-car-t-but-stock-slides-amid-durability-doubts target=""_blank""><div>Link</div></a>"
270,2021-10-13 7:36 PM,MedCity,Lark Health nabs $100M to pour into AI health coaching platform,"The company, which offers an AI platform that provides personalized health coaching for chronic disease patients, will use the new funds to invest in research and development and to expand its virtual integrations with health plans and employers.","<a href=https://medcitynews.com/2021/10/lark-health-nabs-100m-to-pour-into-ai-health-coaching-platform/ target=""_blank""><div>Link</div></a>"
271,2021-10-13 7:30 AM,Biotech,Apnimed sees positives in new sleep apnea drug data,"Just a few months after a modest $25 million raise, little Apnimed has released some broadly positive data for its experimental sleep apnea drug.","<a href=https://www.fiercebiotech.com/biotech/apnimed-sees-positives-midstage-data-for-its-attempt-at-drugging-sleep-apnea-problem target=""_blank""><div>Link</div></a>"
272,2021-10-13 7:00 AM,Biotech,Intellia expands ocular pipeline with 10% stake in SparingVision,Intellia Therapeutics is beefing up its ocular disease pipeline with a 10% equity stake in SparingVision. ,"<a href=https://www.fiercebiotech.com/biotech/after-a-gene-editing-first-intellia-grabs-10-stake-sparingvision-for-collab-eye-gene target=""_blank""><div>Link</div></a>"
273,2021-10-13 7:00 AM,Biotech,Axial tops up funding for phase 2 autism trial with $37M round,Axial Therapeutics has raised $37.3 million to bankroll a phase 2b study testing a small molecule for improving irritability in children with autism.,"<a href=https://www.fiercebiotech.com/biotech/axial-therapeutics-secures-37m-for-mid-stage-trial-autism-work-neurological-diseases target=""_blank""><div>Link</div></a>"
274,2021-10-13 6:06 PM,MedCity,Sprinter raises $33M for ‘last-mile healthcare delivery’ ,"The Menlo Park-based company is building a service for quick at-home health services, such as lab draws and Covid-19 testing. The company is looking to build the “DoorDash for lab draws,” raising $33 million from backers.","<a href=https://medcitynews.com/2021/10/sprinter-raises-33m-for-last-mile-healthcare-delivery/ target=""_blank""><div>Link</div></a>"
275,2021-10-13 4:10 PM,MedCity,"In a first, Colorado gets CMS approval to make gender-affirming care an essential health benefit","All individual and small group health plans in Colorado’s Affordable Care Act marketplace must cover a wide range of gender-affirming services, including breast/chest construction and reductions and laser hair removal, starting Jan. 1, 2023.","<a href=https://medcitynews.com/2021/10/in-a-first-colorado-gets-cms-approval-to-make-gender-affirming-care-an-essential-health-benefit/ target=""_blank""><div>Link</div></a>"
276,2021-10-13 3:20 PM,Biotech,"Charles River dumps research model site, Swedish CDMO for $115M","Charles River Laboratories is parting ways with two divisions for about $115 million, including a Swedish contract developer and manufacturer site.","<a href=https://www.fiercebiotech.com/cro/charles-river-offloads-japan-research-model-site-swedish-gene-therapy-cdmo-for-115m target=""_blank""><div>Link</div></a>"
277,2021-10-13 3:00 PM,Biotech,Protein degrader against 'undruggable' target blocks cancer,"A protein degrader targeting SUMO1 inhibited breast, colon and lung tumors in mice and is now being developed by startup HB Therapeutics.","<a href=https://www.fiercebiotech.com/research/novel-protein-degrader-against-undruggable-cancer-target-inhibits-tumors-mice target=""_blank""><div>Link</div></a>"
278,2021-10-13 2:34 PM,MedCity,Dexcom taps Garmin for first real-time API integration ,"In July, Dexcom got FDA clearance to allow third parties to access its CGM data. To start, it is integrating with Garmin’s wearable devices. ","<a href=https://medcitynews.com/2021/10/dexcom-taps-garmin-for-first-real-time-api-integration/ target=""_blank""><div>Link</div></a>"
279,2021-10-13 2:00 PM,MedCity,"Taking aim at the brain, Takeda strikes up cell therapy R&D alliance with Immusoft","Takeda Pharmaceutical is partnering with startup Immusoft in a research alliance aiming to develop B cell therapies that cross the blood-brain barrier to treat rare neurometabolic disorders. Depending on the progress of the research, Takeda could pay its new partner more than $900 million.","<a href=https://medcitynews.com/2021/10/taking-aim-at-the-brain-takeda-strikes-up-cell-therapy-rd-alliance-with-immusoft/ target=""_blank""><div>Link</div></a>"
280,2021-10-13 2:00 PM,MedCity,Automating patient engagement can improve national roll-out of Covid-19 booster vaccine,"By automating patient engagement, these organizations can reduce the burden on both resources and personnel in fighting this pandemic while improving efficiency in the administration of booster vaccines.","<a href=https://medcitynews.com/2021/10/automating-patient-engagement-can-improve-national-roll-out-of-covid-19-booster-vaccine/ target=""_blank""><div>Link</div></a>"
281,2021-10-13 11:53 AM,Biotech,Olympus investigating 2nd cybersecurity incident in a month,"The suspected incident occurred weeks after Olympus reported an attempted malware attack on its IT systems in Europe, the Middle East and Africa.","<a href=https://www.fiercebiotech.com/medtech/olympus-investigating-potential-cybersecurity-incident-american-it-systems-its-second target=""_blank""><div>Link</div></a>"
282,2021-10-13 11:18 AM,Biotech,Regulus again reprioritizes in attempt to turn ship around,Regulus Therapeutics is once again shuffling its pipeline and sliding a new kidney disease candidate into the high-priority queue.,"<a href=https://www.fiercebiotech.com/biotech/microrna-biotech-regulus-therapeutics-drops-first-generation-adpkd-candidate-focuses-next target=""_blank""><div>Link</div></a>"
283,2021-10-13 11:02 AM,Biotech,Dexcom brings real-time diabetes data to Garmin fitness devices,"After receiving an FDA green light for the project earlier this year, Dexcom is now making its diabetes data available through consumer devices.","<a href=https://www.fiercebiotech.com/medtech/dexcom-garmin-diabetes-fitness-smartwatch-blood-sugar-glucose-tracking target=""_blank""><div>Link</div></a>"
284,2021-10-13 10:15 AM,Biotech,FDA OKs Cochlear's remote programming tool for hearing implants,"Hear ye, hear ye: Patients using Cochlear’s hearing implants can now undergo routine adjustments and receive clinical counseling completely virtually.","<a href=https://www.fiercebiotech.com/medtech/cochlear-secures-two-fda-nods-for-telehealth-solution-to-program-hearing-implants-from-afar target=""_blank""><div>Link</div></a>"
285,2021-10-12 9:35 AM,Biotech,"Poseida, Takeda ink $3.6B pact for 8 non-viral gene therapies",Takeda is on a gene therapy collaboration roll in October with the latest push an up to $3.6 billion pact with Poseida for 6 to 8 gene therapies.,"<a href=https://www.fiercebiotech.com/biotech/billions-club-takeda-taps-poseida-for-second-1b-plus-gene-therapy-pact-2-weeks target=""_blank""><div>Link</div></a>"
286,2021-10-12 8:50 AM,Biotech,"J&J science chief Stoffels to retire, adding to C-suite changes ","J&J CSO Paul Stoffels is to retire at the end of the year, ending a nine-year stint at the top of the rejuvenated R&D unit and creating more turnover.","<a href=https://www.fiercebiotech.com/biotech/j-j-science-chief-stoffels-to-retire-after-decade-at-top-adding-to-c-suite-changes target=""_blank""><div>Link</div></a>"
287,2021-10-12 8:05 AM,Biotech,Biotech backers quit Dana-Farber board after policy U-turn ,"Dana-Farber has barred trustees from newly investing in biotechs created to license its science, leading to the resignation of board members.","<a href=https://www.fiercebiotech.com/biotech/boston-biotech-backers-quit-dana-farber-board-after-u-turn-investment-policy target=""_blank""><div>Link</div></a>"
288,2021-10-12 7:40 AM,Biotech,CureVac giving up on first COVID mRNA vaccine,"With more than a touch of inevitability, CureVac is abandoning its first mRNA COVID vaccine after dismal results earlier this year","<a href=https://www.fiercebiotech.com/biotech/curevac-giving-up-first-covid-mrna-vax-focusing-gsk-partnered-second-attempt target=""_blank""><div>Link</div></a>"
289,2021-10-12 1:02 PM,MedCity,Be part of the conversation at INVEST Pop Health virtual conference and register now,"One of the panel discussions at the conference, scheduled for November 15-16, will focus on data and analytics in the context of population health. ","<a href=https://medcitynews.com/2021/10/be-part-of-the-conversation-at-invest-pop-health-virtual-conference-and-register-now/ target=""_blank""><div>Link</div></a>"
290,2021-10-12 12:56 PM,Biotech,"FDA clears Withings’ smartwatch to detect afib, sleep apnea","There’s a new medical-grade smartwatch in town, and it just might give the long-dominant Apple Watch a run for its money.","<a href=https://www.fiercebiotech.com/medtech/withings-goes-head-to-head-apple-nabbing-fda-ok-for-smartwatch-to-detect-afib-sleep-apnea target=""_blank""><div>Link</div></a>"
291,2021-10-12 12:46 PM,Biotech,Mayo Clinic taps Personalis for cancer genomic testing efforts,Mayo hopes to put Personalis to work expanding genomic testing to diverse patient populations who have not had access to personalized medicine.,"<a href=https://www.fiercebiotech.com/medtech/mayo-clinic-taps-personalis-for-comprehensive-genomic-testing-for-cancer target=""_blank""><div>Link</div></a>"
292,2021-10-12 11:57 AM,MedCity,Health insurers have the power to improve health—let’s do it,"If all insurers adopt a consumer-first mentality, health care—a basic human need and right—can be affordable and accessible to everyone. If that sounds like a fantasy, it’s not. This is within reach.","<a href=https://medcitynews.com/2021/10/health-insurers-have-the-power-to-improve-health-lets-do-it/ target=""_blank""><div>Link</div></a>"
293,2021-10-12 10:49 AM,Biotech,BioNova adds to blood cancer portfolio with $200M Sutro deal,BioNova wants in on Sutro Biopharma's phase 1 antibody-drug conjugate for hematologic cancers and will pay up to $200 million in a licensing deal.,"<a href=https://www.fiercebiotech.com/biotech/bionova-signs-204m-collab-for-sutro-s-early-stage-hematologic-cancer-asset-china target=""_blank""><div>Link</div></a>"
294,2021-10-12 10:35 AM,Biotech,"To ease children through an MRI, Philips makes scans into games",Philips launched a digital coach to help parents and children cope with the stress of the procedure and get out the jitters.,"<a href=https://www.fiercebiotech.com/medtech/to-ease-children-through-a-scary-mri-philips-makes-scanner-a-playground target=""_blank""><div>Link</div></a>"
295,2021-10-12 10:25 AM,Biotech,Roche's Spark adds epilepsy asset to pipeline with $328M deal,Roche’s Spark Therapeutics unit is offering up to $328.5 million in biobucks for CombiGene’s gene therapy for epilepsy.,"<a href=https://www.fiercebiotech.com/biotech/roche-s-spark-adds-epilepsy-asset-to-pipeline-328m-combigene-licensing-deal target=""_blank""><div>Link</div></a>"
296,2021-10-12 10:05 AM,Biotech,MindMaze finds its way to $125M for neuro-rehab game platform,"With the new funding, MindMaze has now achieved the elusive unicorn status, with an estimated valuation of $1.5 billion.","<a href=https://www.fiercebiotech.com/medtech/mindmaze-finds-its-way-to-125m-for-neuro-rehabilitation-video-game-platform target=""_blank""><div>Link</div></a>"
297,2021-10-12 10:00 AM,Biotech,"Broad Institute, Intel upgrade genomic data collab with Google","After half a decade of working together, Intel and the Broad Institute of MIT and Harvard are taking their relationship to the next level.","<a href=https://www.fiercebiotech.com/medtech/broad-institute-looks-to-intel-google-cloud-to-upgrade-genomic-data-processing target=""_blank""><div>Link</div></a>"
298,2021-10-11 9:38 AM,Biotech,Medtronic's Hugo surgical robot heads to Europe with new CE mark,"Medtronic has secured European approval for its Hugo surgical robot, clearing the way for its continental debut.","<a href=https://www.fiercebiotech.com/medtech/medtronic-s-hugo-surgical-robot-heads-to-europe-regulatory-green-light target=""_blank""><div>Link</div></a>"
299,2021-10-11 9:29 AM,MedCity, Why Virgin Pulse bought Welltok,"The merger of the two patient engagement companies will create an organization with more than 2,000 employees. The deal would expand Virgin Pulse’s channels for communicating with patients and help it expand into some new markets. ","<a href=https://medcitynews.com/2021/10/why-virgin-pulse-bought-welltok/ target=""_blank""><div>Link</div></a>"
300,2021-10-11 9:00 AM,MedCity,"SSM Health, Optum to enhance inpatient, RCM & digital services in new 10-year collaboration",The St. Louis-based health system is collaborating with the UnitedHealth subsidiary to implement technology and processes that focus on improving care quality and reducing costs. Thousands of SSM Health employees will transition to Optum as part of the deal. ,"<a href=https://medcitynews.com/2021/10/ssm-health-optum-to-enhance-inpatient-rcm-digital-services-in-new-10-year-collaboration/ target=""_blank""><div>Link</div></a>"
301,2021-10-11 8:44 AM,Biotech,Brain atlas unveils dozens of cell types that control movement,Researchers discovered that the primary motor cortex in the brain houses up to 116 distinct cells—five times more than had been identified before.,"<a href=https://www.fiercebiotech.com/research/brain-atlas-study-from-uc-berkeley-unveils-dozens-cell-types-control-movement-and-could target=""_blank""><div>Link</div></a>"
302,2021-10-11 8:39 AM,Biotech,Idorsi's Fabry drug fails to relieve pain in phase 3 test,"Idorsia’s Fabry disease therapy “did exactly what we were expecting,” according to one executive—except relieve neuropathic pain.","<a href=https://www.fiercebiotech.com/biotech/idorsia-s-fabry-med-fails-phase-3-clinical-trial-does-not-relieve-neuropathic-pain target=""_blank""><div>Link</div></a>"
