,Datetime,Media,Title,Desc,Link
596,2021-09-09 8:29 PM,MedCity,"Genetic meds pioneer James Wilson has a new startup, this time in gene editing","Biotech startup iECURE is based on work from the University of Pennsylvania scientist, who has been researching ways to use in vivo gene editing as a way to “knock in” healthy versions of a gene to treat rare liver diseases. The company, which will develop therapeutic candidates from Penn, has raised $50 million in Series A financing.","<a href=https://medcitynews.com/2021/09/genetic-meds-pioneer-james-wilson-has-a-new-startup-this-time-in-gene-editing/ target=""_blank""><div>Link</div></a>"
597,2021-09-09 7:10 PM,MedCity,Telehealth visits fall from pandemic highs,"They made up 4.5% of total claims in June, according to a report by FAIR Health, compared to 13% of claims in April of 2020. ","<a href=https://medcitynews.com/2021/09/telehealth-visits-fall-from-pandemic-highs/ target=""_blank""><div>Link</div></a>"
598,2021-09-09 6:50 PM,MedCity,Justice Department sues Texas to block restrictive abortion law  ,The Biden administration has issued a legal challenge to invalidate the controversial Texas law that bans abortions after six weeks of pregnancy claiming that it will strip residents of their constitutional rights. ,"<a href=https://medcitynews.com/2021/09/justice-department-sues-texas-to-block-restrictive-abortion-law/ target=""_blank""><div>Link</div></a>"
599,2021-09-09 5:48 PM,MedCity,How tech can help solve the overpayments problem in healthcare RCM,"When CMS overpays for services, providers and commercial payers are responsible for paying the agency back, and at times, they are on the hook for millions of dollars. But technology can help healthcare stakeholders catch the mistakes that lead to overpayments, thereby reducing unnecessary costs. ","<a href=https://medcitynews.com/2021/09/how-tech-can-help-solve-the-overpayments-problem-in-healthcare-rcm/ target=""_blank""><div>Link</div></a>"
600,2021-09-09 3:48 PM,MedCity,Cycle-tracking app Flo raises $50M ,The funding round boosted Flo’s valuation to $800 million. It plans to put the funds toward new technical capabilities and new hires.,"<a href=https://medcitynews.com/2021/09/cycle-tracking-app-flo-raises-50m/ target=""_blank""><div>Link</div></a>"
601,2021-09-09 2:00 PM,MedCity,Reducing low-value care starts by understanding its drivers,"There is no single driver of low-value care — providers, systems, and patients all play a role. But with the right tools, stakeholders can work together to re-align incentives and transform our healthcare delivery system into one that prioritizes value, eliminates waste and leads to better overall patient outcomes.","<a href=https://medcitynews.com/2021/09/reducing-low-value-care-starts-by-understanding-its-drivers/ target=""_blank""><div>Link</div></a>"
602,2021-09-08 9:00 AM,MedCity,Integrating more medical devices will help patients and providers,Providers must recognize that each data point from a medical device has intrinsic value if harnessed properly. The tools exist now to extract more value from medical device data for providers and patients.,"<a href=https://medcitynews.com/2021/09/integrating-more-medical-devices-will-help-patients-and-providers/ target=""_blank""><div>Link</div></a>"
603,2021-09-08 7:05 AM,MedCity,NorthShore University HealthSystem to test Laguna Health’s new post-discharge recovery app,"The app provides users with a personalized recovery plan, education materials and virtual access to a care team that includes behavioral health specialists. The NorthShore system will conduct a clinical trial to test the app after which it will decide whether to deploy the solution across its hospitals.","<a href=https://medcitynews.com/2021/09/northshore-university-health-system-to-test-laguna-healths-new-post-discharge-recovery-app/ target=""_blank""><div>Link</div></a>"
604,2021-09-08 5:39 AM,MedCity,Invitae to buy health records startup Ciitizen for $325M ,"Combining the two companies would allow patients to access genetic testing and their health records in one place, and make it easier for Invitae to collect and organize health records. ","<a href=https://medcitynews.com/2021/09/invitae-to-buy-health-records-startup-ciitizen-for-325m/ target=""_blank""><div>Link</div></a>"
605,2021-09-08 2:52 PM,MedCity,Report: 60% of top 20 US hospitals do not offer online scheduling for new patients,"Not only do a majority of the top 20 hospitals on U.S. News & World Report’s 2020-21 Best Hospitals rankings not offer online scheduling, but about 65% also do not provide new patients the option to schedule a virtual visit online, despite strong consumer preference for digital access to healthcare. ","<a href=https://medcitynews.com/2021/09/report-60-of-top-20-us-hospitals-do-not-offer-online-scheduling-for-new-patients/ target=""_blank""><div>Link</div></a>"
606,2021-09-08 1:47 PM,MedCity,How Covid-19 has changed the role of hospitals,Looking at how hospitals changed during Covid-19 is a starting point for a lot of larger questions in the healthcare industry.,"<a href=https://medcitynews.com/2021/09/how-covid-19-has-changed-the-role-of-hospitals/ target=""_blank""><div>Link</div></a>"
607,2021-09-08 10:47 AM,MedCity,Sanofi scoops up Kadmon and its newly approved drug in a $1.9B deal,"The cash deal brings to Sanofi the Kadmon Holdings drug Rezurock, which the FDA approved in July as a treatment for chronic graft versus host disease. The French pharmaceutical giant will add Rezurock to a lineup of older products marketed globally for transplant procedures.","<a href=https://medcitynews.com/2021/09/sanofi-scoops-up-kadmon-and-its-newly-approved-drug-in-a-1-9b-deal/ target=""_blank""><div>Link</div></a>"
608,2021-09-07 6:20 PM,MedCity,Solv raises $45M to build network of same-day appointments ,"The startup, founded by several former Trulia executives, builds software to help healthcare providers with administrative tasks, including scheduling, registration and price transparency. ","<a href=https://medcitynews.com/2021/09/solv-raises-45m-to-build-network-of-same-day-appointments/ target=""_blank""><div>Link</div></a>"
609,2021-09-07 5:47 PM,MedCity,Roche bets $300M on Adaptimmune tech for off-the-shelf cell therapies for cancer,"Roche is partnering with Adaptimmune Therapeutics to develop allogeneic cell therapies based on Adaptimmune’s technology. In addition to these “off-the-shelf” products, the partners will also develop a personalized allogeneic cell therapy designed specifically for a patient’s cancer.","<a href=https://medcitynews.com/2021/09/roche-bets-300m-on-adaptimmune-tech-for-off-the-shelf-cell-therapies-for-cancer/ target=""_blank""><div>Link</div></a>"
610,2021-09-07 4:43 PM,MedCity,"As Delta surges, CMIOs’ focus on plans to provide vaccine booster shots, fight false information","Chief medical information officers are in a unique position to help their organizations fight the Covid-19 pandemic — from setting up IT systems to support Covid testing, care and vaccination to helping fight fast-spreading misinformation.","<a href=https://medcitynews.com/2021/09/as-delta-surges-cmios-focus-on-plans-to-provide-vaccine-booster-shots-fight-false-information/ target=""_blank""><div>Link</div></a>"
611,2021-09-06 9:30 AM,MedCity,Should we do away with ACOs? The answer depends on who you ask  ,"In a new study, researchers suggest ACOs are not helping CMS save substantial amounts of money as they were expected to do, so the model should be eliminated. But other experts in the industry disagree, taking issue with the study’s methods and conclusions. ","<a href=https://medcitynews.com/2021/09/should-we-do-away-with-acos-the-answer-depends-on-who-you-ask/ target=""_blank""><div>Link</div></a>"
612,2021-09-06 9:08 AM,MedCity,Report: Cityblock now valued at $5.7B,"According to STAT News, Cityblock raised a $400 million funding round led by SoftBank. It plans to put the capital toward its goal of serving 10 million members by 2030. ","<a href=https://medcitynews.com/2021/09/report-cityblock-now-valued-at-5-7b/ target=""_blank""><div>Link</div></a>"
613,2021-09-06 9:00 AM,MedCity,Overcoming the buyer’s market: A guide to hiring a digital health CEO,"As a result of digital health adoption soaring during the pandemic, health tech companies looking to hire a new CEO face more competition, but here are some tips to successfully hire the right leader who can navigate the inflection points of growth and steer digital health companies to success.","<a href=https://medcitynews.com/2021/09/overcoming-the-buyers-market-a-guide-to-hiring-a-digital-health-ceo/ target=""_blank""><div>Link</div></a>"
614,2021-09-06 10:30 AM,MedCity,"After Google, Microsoft struck out, can Apple get people to use its health records feature?",Apple has integrated with 700 providers for its health records app. But it faces a similar challenge to other health records projects that have failed in the past: patient uptake. ,"<a href=https://medcitynews.com/2021/09/546989/ target=""_blank""><div>Link</div></a>"
615,2021-09-03 6:40 PM,MedCity,Impel NeuroPharma’s drug-device combo product nabs FDA nod for migraine,"The FDA approved an Impel NeuroPharma migraine treatment, a nasal spray intended to bring pain relief more quickly than drugs administered in other ways. It marks the first approval for the Seattle company, which has developed a proprietary nasal delivery technology.","<a href=https://medcitynews.com/2021/09/impel-neuropharmas-drug-device-combo-product-nabs-fda-nod-for-migraine/ target=""_blank""><div>Link</div></a>"
616,2021-09-03 5:57 PM,MedCity,UnitedHealthcare to expand ACA exchange offerings to 7 new states,"UnitedHealthcare is planning to participate in the ACA insurance exchanges in Alabama, Florida, Georgia, Illinois, Louisiana, Michigan and Texas. This will bring its total ACA marketplace footprint to 18 states. ","<a href=https://medcitynews.com/2021/09/unitedhealthcare-to-expand-aca-exchange-offerings-to-7-new-states/ target=""_blank""><div>Link</div></a>"
617,2021-09-03 3:26 PM,MedCity,"Report: Apple Watch to add blood pressure, thermometer features","According to a report by the Wall Street Journal, Apple is planning to add more health features to its watch, including a feature to track blood pressure and a wrist-based thermometer. ","<a href=https://medcitynews.com/2021/09/report-apple-watch-to-add-blood-pressure-thermometer-features/ target=""_blank""><div>Link</div></a>"
618,2021-09-03 2:07 PM,MedCity,"Feds slap UPMC, cardiothoracic surgery chair with billing fraud suit","The lawsuit alleges that UPMC and the chair of its cardiothoracic surgery department knowing submitted false claims for concurrent surgeries that violated regulations. But, according to UPMC, there is no regulation that prohibits overlapping surgeries or billing for them. ","<a href=https://medcitynews.com/2021/09/feds-slap-upmc-cardiothoracic-surgery-chair-with-billing-fraud-suit/ target=""_blank""><div>Link</div></a>"
619,2021-09-03 2:00 PM,MedCity,10 issues every healthcare leader should be thinking about,"Healthcare organizations demonstrated tremendous vision, innovation and flexibility as they navigated unprecedented challenges brought on by the pandemic. However, the challenges and changes to the healthcare industry will continue long after Covid-19 disappears. ","<a href=https://medcitynews.com/2021/09/10-issues-every-healthcare-leader-should-be-thinking-about/ target=""_blank""><div>Link</div></a>"
620,2021-09-02 9:00 AM,MedCity,Collaborative care with a virtual lens: enabling patients and providers to overcome the mental health crisis,"By establishing a virtual relationship with consulting telepsychiatrists, psychiatric nurse practitioners, and licensed clinical social workers, PCPs and their behavioral care managers have access anytime to the appropriate support for patients’ mental health needs.","<a href=https://medcitynews.com/2021/09/collaborative-care-with-a-virtual-lens-enabling-patients-and-providers-to-overcome-the-mental-health-crisis/ target=""_blank""><div>Link</div></a>"
621,2021-09-02 6:16 AM,MedCity,Impedimed device gets breakthrough designation for kidney failure,The company’s bioimpedance spectroscopy device would be used to measure how much fluid should be removed from a patient during dialysis. ,"<a href=https://medcitynews.com/2021/09/impedimed-device-gets-breakthrough-designation-for-kidney-failure/ target=""_blank""><div>Link</div></a>"
622,2021-09-02 2:51 PM,MedCity,Survey: 40% of health systems ramping up hiring efforts amid workforce shortage,"A majority of organizations (93%) said they are focused on both attracting and retaining top talent, a new survey from Aon shows. They are offering various benefits to do so, including onsite or near-site health clinics for employees.","<a href=https://medcitynews.com/2021/09/survey-40-of-health-systems-ramping-up-hiring-efforts-amid-workforce-shortage/ target=""_blank""><div>Link</div></a>"
623,2021-09-02 2:00 PM,MedCity,It’s time to relieve electronic prior authorization bottlenecks,"It’s time to embrace electronic prior authorization that, according to a 2021 AHIP study, has been found to reduce the mean time from PA request to decision by 69%. In addition, 71% of providers using ePA reported “faster time to patient care.”","<a href=https://medcitynews.com/2021/09/its-time-to-relieve-electronic-prior-authorization-bottlenecks/ target=""_blank""><div>Link</div></a>"
624,2021-09-02 1:23 PM,MedCity,"To make trials more inclusive, H1 wants to help find the right physicians",The company rolled out a tool to help pharmaceutical companies pull together information about clinical trial sites and identify the best physician investigators for a trial. ,"<a href=https://medcitynews.com/2021/09/to-make-trials-more-inclusive-h1-wants-to-help-find-the-right-physicians/ target=""_blank""><div>Link</div></a>"
625,2021-09-02 12:51 PM,MedCity,INVEST Digital Health Preview: Mapping the Digital Future of Pharma,"INVEST Digital Health is set for September 20-23, and held in collaboration with Medical Alley. The healthcare conference, held in a virtual format due to Covid-19, brings together innovative investors across the healthcare spectrum, prominent industry players and the most promising digital health startups.","<a href=https://medcitynews.com/2021/09/invest-digital-health-preview-mapping-the-digital-future-of-pharma/ target=""_blank""><div>Link</div></a>"
626,2021-09-02 11:31 AM,MedCity,Assembly Bio drops hepatitis B drug after liver problems surface in clinical trial,"Four patients dosed with an experimental Assembly Biosciences hepatitis B treatment developed high levels of liver enzymes, a sign of drug-induced liver toxicity. The biotech has decided to stop further work on that drug and focus instead on developing its other clinical-stage hepatitis B drugs.","<a href=https://medcitynews.com/2021/09/assembly-bio-drops-hepatitis-b-drug-after-liver-problems-surface-in-clinical-trial/ target=""_blank""><div>Link</div></a>"
627,2021-09-01 6:53 PM,MedCity,"Akron Children’s, CareSource to launch ACO","Dubbed the Akron Children’s Health Collaborative, the pediatric ACO will focus on improving care for the approximately 100,000 children in Ohio covered by Medicaid whose benefits are managed by CareSource.","<a href=https://medcitynews.com/2021/09/akron-childrens-caresource-to-launch-aco/ target=""_blank""><div>Link</div></a>"
628,2021-09-01 6:00 PM,MedCity,"Big Health tests if insomnia app can help with anxiety, depression",The company recently finished a study showing patients in the U.K. who used both Sleepio’s app and therapy saw improvements in anxiety and depression compared to people who used therapy alone. But the study also had several limitations. ,"<a href=https://medcitynews.com/2021/09/big-health-tests-if-insomnia-app-can-help-with-anxiety-depression/ target=""_blank""><div>Link</div></a>"
629,2021-08-31 9:00 AM,MedCity,MedCity Pivot Podcast: Our reporters unplugged,"After more than a year’s worth of interviewing external experts, the Pivot podcast is turning its gaze inward to demystify — as much as possible — why we write the stories we write.","<a href=https://medcitynews.com/2021/08/medcity-pivot-podcast-our-reporters-unplugged/ target=""_blank""><div>Link</div></a>"
630,2021-08-31 9:00 AM,MedCity,The distraction of real-time insight,"Clinical decision support systems don’t need to be distracting. We can design them to stop pointing out the patients in the middle of catastrophe, and start helping us prevent them from ever arriving there.","<a href=https://medcitynews.com/2021/08/the-distraction-of-real-time-insight/ target=""_blank""><div>Link</div></a>"
631,2021-08-31 7:30 AM,MedCity,INVEST Digital Health Pitch Perfect Preview: Home Health,"Read more to find out which finalists will present in the Home Health track of the startup pitch contest during the virtual conference, scheduled for September 20-23.","<a href=https://medcitynews.com/2021/08/invest-digital-health-pitch-perfect-preview-home-health/ target=""_blank""><div>Link</div></a>"
632,2021-08-31 7:00 AM,MedCity,Sesame adds online pharmacy to cash-pay marketplace,"The startup, where patients access cash-pay telehealth and in-person visits, recently added prescription delivery through Truepill. It’s offering a list of generic medications for $5. ","<a href=https://medcitynews.com/2021/08/sesame-adds-online-pharmacy-to-cash-pay-marketplace/ target=""_blank""><div>Link</div></a>"
633,2021-08-31 6:04 PM,MedCity,"J&J HIV vaccine fails study in Africa, but a separate clinical trial continues in Europe, Americas",Johnson & Johnson reported results from a mid-stage study in southern Africa showing just 25% efficacy for its HIV vaccine. J&J developed the HIV vaccine with the same technology used in its successful Ebola and Covid-19 vaccines.,"<a href=https://medcitynews.com/2021/08/jj-hiv-vaccine-fails-study-in-africa-but-a-separate-clinical-trial-continues-in-europe-americas/ target=""_blank""><div>Link</div></a>"
634,2021-08-31 6:01 PM,MedCity,Meet the two picks from J&J and Village Capital’s culturally competent care accelerator,"Johnson & Johnson Impact Ventures and Village Capital launched their first accelerator focused on culturally competent care this summer. Two startups were each awarded $100,000: Omaiven Health and Lucia Health Guidelines.","<a href=https://medcitynews.com/2021/08/meet-the-two-picks-from-jj-and-village-capitals-culturally-competent-care-accelerator/ target=""_blank""><div>Link</div></a>"
635,2021-08-31 2:53 PM,MedCity,Versanis Bio unveils $70M and a Novartis drug ready for Phase 2 test in obesity,"Novartis was unsuccessful developing bimagrumab as a treatment for a rare muscle disorder, but additional tests showed encouraging results in fat reduction. Startup Versanis Bio licensed rights to the antibody and plans to use its Series A financing for clinical trials testing the drug in obese patients.","<a href=https://medcitynews.com/2021/08/versanis-bio-unveils-70m-and-a-novartis-drug-ready-for-phase-2-test-in-obesity/ target=""_blank""><div>Link</div></a>"
636,2021-08-31 1:50 PM,MedCity,Sutter Health to pay $90M to resolve False Claims allegations,The California-based health system will pay a hefty price to resolve allegations that it knowingly submitted inflated diagnosis codes for certain Medicare Advantage beneficiaries to receive higher payments. Sutter Health does not admit any liability in the matter. ,"<a href=https://medcitynews.com/2021/08/sutter-health-to-pay-90m-to-resolve-false-claims-allegations/ target=""_blank""><div>Link</div></a>"
637,2021-08-31 11:52 AM,MedCity,How did Innovaccer save Elevate Health $6M in healthcare costs?,Innovaccer helped Elevate Health overcome three substantial care coordination obstacles. ,"<a href=https://medcitynews.com/2021/08/how-did-innovaccer-save-elevate-health-6m-in-healthcare-costs/ target=""_blank""><div>Link</div></a>"
638,2021-08-30 9:00 AM,MedCity,How data-driven feedback in surgical robotics can help democratize access to surgery,The goal is not to enable a robot to perform complex surgeries without human involvement. But using surgical robotics to democratize access to quality care to underserved communities is an outcome that we can achieve and which the world needs.,"<a href=https://medcitynews.com/2021/08/how-data-driven-feedback-in-surgical-robotics-can-help-democratize-access-to-surgery/ target=""_blank""><div>Link</div></a>"
639,2021-08-30 1:24 PM,MedCity,"Pfizer eczema contender beats Dupixent in study, but JAK drug class is still in limbo",Pfizer has preliminary data showing its experimental drug for atopic dermatitis beat a blockbuster drug from Regeneron Pharmaceuticals in a head-to-head clinical trial. But the future of that drug and others might depend more on an FDA review of safety data for medicines in this class of so-called JAK inhibitors.,"<a href=https://medcitynews.com/2021/08/pfizer-eczema-contender-beats-dupixent-in-study-but-jak-drug-class-is-still-in-limbo/ target=""_blank""><div>Link</div></a>"
640,2021-08-29 8:30 AM,MedCity,Report: Patient revenue of largest nonprofit health systems fell 21% during Covid,"As net patient revenue declined, operating expenses rose 5% from 2019 to 2020, according to an analysis of financial statements from the 25 largest nonprofit health systems in the U.S. ","<a href=https://medcitynews.com/2021/08/report-patient-revenue-of-largest-nonprofit-health-systems-fell-21-during-covid/ target=""_blank""><div>Link</div></a>"
641,2021-08-29 8:10 AM,MedCity,"Covid news recap: Comirnaty approved, J&J’s booster boast, new BD test & more","Full FDA approval of Pfizer and BioNTech’s Covid-19 vaccine was the biggest news in a busy week for coronavirus vaccines, drugs, and diagnostics. Here’s a look back at some of the major developments.","<a href=https://medcitynews.com/2021/08/covid-news-recap-comirnaty-approved-jjs-booster-boast-new-bd-test-more/ target=""_blank""><div>Link</div></a>"
642,2021-08-29 8:01 AM,MedCity,Healthcare automation company Olive launches venture studio,"The company currently has two incubating startups, Violet, a bank to help people with medical bills, and Rotera, an AI consulting firm for health systems. ","<a href=https://medcitynews.com/2021/08/healthcare-automation-company-olive-launches-venture-studio/ target=""_blank""><div>Link</div></a>"
643,2021-08-29 10:00 AM,MedCity,How peer support is connecting people and changing health outcomes,"Peer support is always there to empower people to take the next steps on their path to a healthier, happier existence.","<a href=https://medcitynews.com/2021/08/how-peer-support-is-connecting-people-and-changing-health-outcomes/ target=""_blank""><div>Link</div></a>"
644,2021-08-27 3:50 PM,MedCity,Peloton subpoenaed over reporting of treadmill injuries,"The Department of Justice and the Department of Homeland Security subpoenaed the company for information related to its reporting of injuries, Peloton disclosed in an SEC filing on Friday. The company recalled its line of treadmills earlier this year after multiple reports of injuries and one death. ","<a href=https://medcitynews.com/2021/08/peloton-subpoenaed-over-reporting-of-treadmill-injuries/ target=""_blank""><div>Link</div></a>"
645,2021-08-27 2:17 PM,MedCity,Antidote Health nabs $12M in seed round to grow AI-driven virtual HMO,"The company offers clinical triage via an artificial intelligence-powered chatbot and unlimited virtual visits through a majority of its plans. Inspired by the Israeli healthcare system, patients on Antidote plans pay a monthly membership fee. ","<a href=https://medcitynews.com/2021/08/antidote-health-nabs-12m-in-seed-round-to-grow-ai-driven-virtual-hmo/ target=""_blank""><div>Link</div></a>"
646,2021-08-27 1:59 PM,MedCity,BioMarin stands tall with first approved drug for rare disease that causes dwarfism,"The European Commission has approved a BioMarin Pharmaceutical drug that treats achondroplasia, a rare genetic disorder that slows bone growth and is the most common cause of dwarfism. The commission also granted conditional approval to a cancer drug from partners Incyte and MorphoSys.","<a href=https://medcitynews.com/2021/08/biomarin-stands-tall-with-first-approved-drug-for-rare-disease-that-causes-dwarfism/ target=""_blank""><div>Link</div></a>"
647,2021-08-26 4:12 PM,MedCity,Providers anxious about reporting requirements surrounding how they spent CARES Act funds,"Providers must report how they spent funding received via the CARES Act by Sept. 30, but they are still grappling with questions related to what expenses need to be reported amid shifting government guidance. ","<a href=https://medcitynews.com/2021/08/providers-anxious-about-reporting-requirements-surrounding-how-they-spent-cares-act-funds/ target=""_blank""><div>Link</div></a>"
648,2021-08-26 12:35 PM,MedCity,ADC Therapeutics strikes a $325M royalty deal to fuel its cancer drug strategy,The royalty agreement with HealthCare Royalty Partners will support ADC Therapeutics’ plans to commercialize its newly approved cancer drug and develop the next one in its pipeline. The biotech’s drug Zynlonta is the first of its type approved by the FDA as a treatment for diffuse large cell B-cell lymphoma,"<a href=https://medcitynews.com/2021/08/adc-therapeutics-strikes-a-325m-royalty-deal-to-fuel-its-cancer-drug-strategy/ target=""_blank""><div>Link</div></a>"
